{
  "metadata": {
    "scan_time": "2025-10-29T00:20:27.285616",
    "log_file": "sample-logs\\test-logs.jsonl",
    "total_traces": 13,
    "parse_errors": 0,
    "duration_ms": 0,
    "crashlens_version": "1.0.0",
    "health_score": 42
  },
  "summary": {
    "total_issues": 26,
    "critical": 0,
    "high": 2,
    "medium": 24,
    "low": 0,
    "total_cost": 0.0,
    "potential_savings": 0.083372,
    "cost_currency": "USD"
  },
  "issues": [
    {
      "id": "retry_loop_0_retry_0e89d768",
      "type": "retry_loop",
      "severity": "high",
      "title": "Retry loop detected with 6 identical calls using gpt-4-turbo for the same prompt. Quality score: 85/100 (higher is worse). No exponential backoff detected.",
      "description": "Retry loop detected with 6 identical calls using gpt-4-turbo for the same prompt. Quality score: 85/100 (higher is worse). No exponential backoff detected.",
      "trace_id": "retry_0e89d768",
      "model": "gpt-4-turbo",
      "cost": {
        "total": 0.0,
        "wasted": 0.00485,
        "currency": "USD"
      },
      "metrics": {
        "tokens": 0,
        "calls": 1,
        "latency_ms": 0
      },
      "recommendation": "",
      "timestamp": "2025-10-29T00:20:27.285616"
    },
    {
      "id": "retry_loop_1_retry_954e978d",
      "type": "retry_loop",
      "severity": "high",
      "title": "Retry loop detected with 4 identical calls using gpt-4 for the same prompt. Quality score: 75/100 (higher is worse). No exponential backoff detected.",
      "description": "Retry loop detected with 4 identical calls using gpt-4 for the same prompt. Quality score: 75/100 (higher is worse). No exponential backoff detected.",
      "trace_id": "retry_954e978d",
      "model": "gpt-4",
      "cost": {
        "total": 0.0,
        "wasted": 0.0069,
        "currency": "USD"
      },
      "metrics": {
        "tokens": 0,
        "calls": 1,
        "latency_ms": 0
      },
      "recommendation": "",
      "timestamp": "2025-10-29T00:20:27.285616"
    },
    {
      "id": "retry_loop_2_retry_cc755128",
      "type": "retry_loop",
      "severity": "medium",
      "title": "Retry loop detected with 5 identical calls using gpt-4 for the same prompt. Quality score: 45/100 (higher is worse). No exponential backoff detected.",
      "description": "Retry loop detected with 5 identical calls using gpt-4 for the same prompt. Quality score: 45/100 (higher is worse). No exponential backoff detected.",
      "trace_id": "retry_cc755128",
      "model": "gpt-4",
      "cost": {
        "total": 0.0,
        "wasted": 0.01707,
        "currency": "USD"
      },
      "metrics": {
        "tokens": 0,
        "calls": 1,
        "latency_ms": 0
      },
      "recommendation": "",
      "timestamp": "2025-10-29T00:20:27.285616"
    },
    {
      "id": "retry_loop_3_retry_93ab39c6",
      "type": "retry_loop",
      "severity": "medium",
      "title": "Retry loop detected with 4 identical calls using gpt-4 for the same prompt. Quality score: 50/100 (higher is worse). No exponential backoff detected.",
      "description": "Retry loop detected with 4 identical calls using gpt-4 for the same prompt. Quality score: 50/100 (higher is worse). No exponential backoff detected.",
      "trace_id": "retry_93ab39c6",
      "model": "gpt-4",
      "cost": {
        "total": 0.0,
        "wasted": 0.0201,
        "currency": "USD"
      },
      "metrics": {
        "tokens": 0,
        "calls": 1,
        "latency_ms": 0
      },
      "recommendation": "",
      "timestamp": "2025-10-29T00:20:27.285616"
    },
    {
      "id": "retry_loop_4_retry_d18a4432",
      "type": "retry_loop",
      "severity": "medium",
      "title": "Retry loop detected with 4 identical calls using gpt-4o for the same prompt. Quality score: 50/100 (higher is worse). No exponential backoff detected.",
      "description": "Retry loop detected with 4 identical calls using gpt-4o for the same prompt. Quality score: 50/100 (higher is worse). No exponential backoff detected.",
      "trace_id": "retry_d18a4432",
      "model": "gpt-4o",
      "cost": {
        "total": 0.0,
        "wasted": 0.002545,
        "currency": "USD"
      },
      "metrics": {
        "tokens": 0,
        "calls": 1,
        "latency_ms": 0
      },
      "recommendation": "",
      "timestamp": "2025-10-29T00:20:27.285616"
    },
    {
      "id": "retry_loop_5_retry_559662a9",
      "type": "retry_loop",
      "severity": "medium",
      "title": "Retry loop detected with 4 identical calls using gpt-4o for the same prompt. Quality score: 50/100 (higher is worse). No exponential backoff detected.",
      "description": "Retry loop detected with 4 identical calls using gpt-4o for the same prompt. Quality score: 50/100 (higher is worse). No exponential backoff detected.",
      "trace_id": "retry_559662a9",
      "model": "gpt-4o",
      "cost": {
        "total": 0.0,
        "wasted": 0.002115,
        "currency": "USD"
      },
      "metrics": {
        "tokens": 0,
        "calls": 1,
        "latency_ms": 0
      },
      "recommendation": "",
      "timestamp": "2025-10-29T00:20:27.285616"
    },
    {
      "id": "overkill_model_0_retry_9442330b",
      "type": "overkill_model",
      "severity": "medium",
      "title": "Overkill: gpt-4-turbo used for simple task (prompt too short (53 chars))",
      "description": "Overkill: gpt-4-turbo used for simple task (prompt too short (53 chars))",
      "trace_id": "retry_9442330b",
      "model": "gpt-4-turbo",
      "cost": {
        "total": 0.0,
        "wasted": 0.000364,
        "currency": "USD"
      },
      "metrics": {
        "tokens": 0,
        "calls": 1,
        "latency_ms": 0
      },
      "recommendation": "",
      "timestamp": "2025-10-29T00:20:27.285616"
    },
    {
      "id": "overkill_model_1_retry_9442330b",
      "type": "overkill_model",
      "severity": "medium",
      "title": "Overkill: gpt-4-turbo used for simple task (prompt too short (53 chars))",
      "description": "Overkill: gpt-4-turbo used for simple task (prompt too short (53 chars))",
      "trace_id": "retry_9442330b",
      "model": "gpt-4-turbo",
      "cost": {
        "total": 0.0,
        "wasted": 0.000217,
        "currency": "USD"
      },
      "metrics": {
        "tokens": 0,
        "calls": 1,
        "latency_ms": 0
      },
      "recommendation": "",
      "timestamp": "2025-10-29T00:20:27.285616"
    },
    {
      "id": "overkill_model_2_retry_9442330b",
      "type": "overkill_model",
      "severity": "medium",
      "title": "Overkill: gpt-4-turbo used for simple task (prompt too short (53 chars))",
      "description": "Overkill: gpt-4-turbo used for simple task (prompt too short (53 chars))",
      "trace_id": "retry_9442330b",
      "model": "gpt-4-turbo",
      "cost": {
        "total": 0.0,
        "wasted": 0.000602,
        "currency": "USD"
      },
      "metrics": {
        "tokens": 0,
        "calls": 1,
        "latency_ms": 0
      },
      "recommendation": "",
      "timestamp": "2025-10-29T00:20:27.285616"
    },
    {
      "id": "overkill_model_3_retry_9442330b",
      "type": "overkill_model",
      "severity": "medium",
      "title": "Overkill: gpt-4-turbo used for simple task (prompt too short (53 chars))",
      "description": "Overkill: gpt-4-turbo used for simple task (prompt too short (53 chars))",
      "trace_id": "retry_9442330b",
      "model": "gpt-4-turbo",
      "cost": {
        "total": 0.0,
        "wasted": 0.003115,
        "currency": "USD"
      },
      "metrics": {
        "tokens": 0,
        "calls": 1,
        "latency_ms": 0
      },
      "recommendation": "",
      "timestamp": "2025-10-29T00:20:27.285616"
    },
    {
      "id": "overkill_model_4_retry_ef493f8c",
      "type": "overkill_model",
      "severity": "medium",
      "title": "Overkill: gpt-4-turbo used for simple task (prompt too short (140 chars))",
      "description": "Overkill: gpt-4-turbo used for simple task (prompt too short (140 chars))",
      "trace_id": "retry_ef493f8c",
      "model": "gpt-4-turbo",
      "cost": {
        "total": 0.0,
        "wasted": 8.4e-05,
        "currency": "USD"
      },
      "metrics": {
        "tokens": 0,
        "calls": 1,
        "latency_ms": 0
      },
      "recommendation": "",
      "timestamp": "2025-10-29T00:20:27.285616"
    },
    {
      "id": "overkill_model_5_retry_ef493f8c",
      "type": "overkill_model",
      "severity": "medium",
      "title": "Overkill: gpt-4-turbo used for simple task (prompt too short (140 chars))",
      "description": "Overkill: gpt-4-turbo used for simple task (prompt too short (140 chars))",
      "trace_id": "retry_ef493f8c",
      "model": "gpt-4-turbo",
      "cost": {
        "total": 0.0,
        "wasted": 0.000805,
        "currency": "USD"
      },
      "metrics": {
        "tokens": 0,
        "calls": 1,
        "latency_ms": 0
      },
      "recommendation": "",
      "timestamp": "2025-10-29T00:20:27.285616"
    },
    {
      "id": "overkill_model_6_retry_ef493f8c",
      "type": "overkill_model",
      "severity": "medium",
      "title": "Overkill: gpt-4-turbo used for simple task (prompt too short (140 chars))",
      "description": "Overkill: gpt-4-turbo used for simple task (prompt too short (140 chars))",
      "trace_id": "retry_ef493f8c",
      "model": "gpt-4-turbo",
      "cost": {
        "total": 0.0,
        "wasted": 0.000791,
        "currency": "USD"
      },
      "metrics": {
        "tokens": 0,
        "calls": 1,
        "latency_ms": 0
      },
      "recommendation": "",
      "timestamp": "2025-10-29T00:20:27.285616"
    },
    {
      "id": "overkill_model_7_retry_ef493f8c",
      "type": "overkill_model",
      "severity": "medium",
      "title": "Overkill: gpt-4-turbo used for simple task (prompt too short (140 chars))",
      "description": "Overkill: gpt-4-turbo used for simple task (prompt too short (140 chars))",